{
  "prototype_id": "static_opt",
  "item_id": "face_pull",
  "joint_angles": {
    "unit": "deg",
    "times_s": [
      0.0,
      0.03333,
      0.06667,
      0.1,
      0.13333,
      0.16667,
      0.2,
      0.23333,
      0.26667,
      0.3,
      0.33333,
      0.36667,
      0.4,
      0.43333,
      0.46667,
      0.5,
      0.53333,
      0.56667,
      0.6,
      0.63333,
      0.66667,
      0.7,
      0.73333,
      0.76667,
      0.8,
      0.83333,
      0.86667,
      0.9,
      0.93333,
      0.96667,
      1.0
    ],
    "coordinates": [
      "hip_flexion",
      "knee_flexion",
      "shoulder_flexion",
      "shoulder_abduction",
      "shoulder_horizontal_abduction",
      "shoulder_external_rotation",
      "elbow_flexion",
      "scapular_retraction"
    ],
    "values": [
      [
        0.0,
        0.0,
        0.0,
        75.0,
        -5.0,
        0.0,
        90.0,
        0.0
      ],
      [
        0.0,
        0.0,
        0.0,
        75.0163,
        -4.8696,
        0.1304,
        90.0,
        0.0717
      ],
      [
        0.0,
        0.0,
        0.0,
        75.0637,
        -4.4904,
        0.5096,
        90.0,
        0.2803
      ],
      [
        0.0,
        0.0,
        0.0,
        75.14,
        -3.88,
        1.12,
        90.0,
        0.616
      ],
      [
        0.0,
        0.0,
        0.0,
        75.243,
        -3.0563,
        1.9437,
        90.0,
        1.069
      ],
      [
        0.0,
        0.0,
        0.0,
        75.3704,
        -2.037,
        2.963,
        90.0,
        1.6296
      ],
      [
        0.0,
        0.0,
        0.0,
        75.52,
        -0.84,
        4.16,
        90.0,
        2.288
      ],
      [
        0.0,
        0.0,
        0.0,
        75.6896,
        0.517,
        5.517,
        90.0,
        3.0344
      ],
      [
        0.0,
        0.0,
        0.0,
        75.877,
        2.0163,
        7.0163,
        90.0,
        3.859
      ],
      [
        0.0,
        0.0,
        0.0,
        76.08,
        3.64,
        8.64,
        90.0,
        4.752
      ],
      [
        0.0,
        0.0,
        0.0,
        76.2963,
        5.3704,
        10.3704,
        90.0,
        5.7037
      ],
      [
        0.0,
        0.0,
        0.0,
        76.5237,
        7.1896,
        12.1896,
        90.0,
        6.7043
      ],
      [
        0.0,
        0.0,
        0.0,
        76.76,
        9.08,
        14.08,
        90.0,
        7.744
      ],
      [
        0.0,
        0.0,
        0.0,
        77.003,
        11.0237,
        16.0237,
        90.0,
        8.813
      ],
      [
        0.0,
        0.0,
        0.0,
        77.2504,
        13.003,
        18.003,
        90.0,
        9.9016
      ],
      [
        0.0,
        0.0,
        0.0,
        77.5,
        15.0,
        20.0,
        90.0,
        11.0
      ],
      [
        0.0,
        0.0,
        0.0,
        77.7496,
        16.997,
        21.997,
        90.0,
        12.0984
      ],
      [
        0.0,
        0.0,
        0.0,
        77.997,
        18.9763,
        23.9763,
        90.0,
        13.187
      ],
      [
        0.0,
        0.0,
        0.0,
        78.24,
        20.92,
        25.92,
        90.0,
        14.256
      ],
      [
        0.0,
        0.0,
        0.0,
        78.4763,
        22.8104,
        27.8104,
        90.0,
        15.2957
      ],
      [
        0.0,
        0.0,
        0.0,
        78.7037,
        24.6296,
        29.6296,
        90.0,
        16.2963
      ],
      [
        0.0,
        0.0,
        0.0,
        78.92,
        26.36,
        31.36,
        90.0,
        17.248
      ],
      [
        0.0,
        0.0,
        0.0,
        79.123,
        27.9837,
        32.9837,
        90.0,
        18.141
      ],
      [
        0.0,
        0.0,
        0.0,
        79.3104,
        29.483,
        34.483,
        90.0,
        18.9656
      ],
      [
        0.0,
        0.0,
        0.0,
        79.48,
        30.84,
        35.84,
        90.0,
        19.712
      ],
      [
        0.0,
        0.0,
        0.0,
        79.6296,
        32.037,
        37.037,
        90.0,
        20.3704
      ],
      [
        0.0,
        0.0,
        0.0,
        79.757,
        33.0563,
        38.0563,
        90.0,
        20.931
      ],
      [
        0.0,
        0.0,
        0.0,
        79.86,
        33.88,
        38.88,
        90.0,
        21.384
      ],
      [
        0.0,
        0.0,
        0.0,
        79.9363,
        34.4904,
        39.4904,
        90.0,
        21.7197
      ],
      [
        0.0,
        0.0,
        0.0,
        79.9837,
        34.8696,
        39.8696,
        90.0,
        21.9283
      ],
      [
        0.0,
        0.0,
        0.0,
        80.0,
        35.0,
        40.0,
        90.0,
        22.0
      ]
    ]
  },
  "muscle_roles": {
    "times_s": [
      0.0,
      0.03333,
      0.06667,
      0.1,
      0.13333,
      0.16667,
      0.2,
      0.23333,
      0.26667,
      0.3,
      0.33333,
      0.36667,
      0.4,
      0.43333,
      0.46667,
      0.5,
      0.53333,
      0.56667,
      0.6,
      0.63333,
      0.66667,
      0.7,
      0.73333,
      0.76667,
      0.8,
      0.83333,
      0.86667,
      0.9,
      0.93333,
      0.96667,
      1.0
    ],
    "names": [
      "biceps_brachii",
      "brachialis",
      "brachioradialis",
      "triceps_brachii",
      "anterior_deltoid",
      "posterior_deltoid",
      "gluteus_maximus",
      "biceps_femoris",
      "vastus_lateralis",
      "iliopsoas",
      "infraspinatus",
      "teres_minor",
      "subscapularis",
      "supraspinatus",
      "middle_trapezius",
      "lower_trapezius",
      "rhomboid_major",
      "latissimus_dorsi",
      "pectoralis_major"
    ],
    "roles": [
      [
        "inactive",
        "stabilizer",
        "stabilizer",
        "prime_mover",
        "inactive",
        "inactive",
        "inactive",
        "inactive",
        "inactive",
        "inactive",
        "stabilizer",
        "stabilizer",
        "inactive",
        "inactive",
        "prime_mover",
        "prime_mover",
        "prime_mover",
        "antagonist",
        "antagonist"
      ],
      [
        "inactive",
        "stabilizer",
        "stabilizer",
        "prime_mover",
        "inactive",
        "inactive",
        "inactive",
        "inactive",
        "inactive",
        "inactive",
        "stabilizer",
        "stabilizer",
        "inactive",
        "inactive",
        "prime_mover",
        "prime_mover",
        "prime_mover",
        "antagonist",
        "antagonist"
      ],
      [
        "inactive",
        "stabilizer",
        "stabilizer",
        "prime_mover",
        "inactive",
        "inactive",
        "inactive",
        "inactive",
        "inactive",
        "inactive",
        "stabilizer",
        "stabilizer",
        "inactive",
        "inactive",
        "prime_mover",
        "prime_mover",
        "prime_mover",
        "antagonist",
        "antagonist"
      ],
      [
        "inactive",
        "stabilizer",
        "stabilizer",
        "prime_mover",
        "inactive",
        "inactive",
        "inactive",
        "inactive",
        "inactive",
        "inactive",
        "stabilizer",
        "stabilizer",
        "inactive",
        "inactive",
        "prime_mover",
        "prime_mover",
        "prime_mover",
        "antagonist",
        "antagonist"
      ],
      [
        "inactive",
        "stabilizer",
        "stabilizer",
        "prime_mover",
        "inactive",
        "inactive",
        "inactive",
        "inactive",
        "inactive",
        "inactive",
        "stabilizer",
        "stabilizer",
        "inactive",
        "inactive",
        "prime_mover",
        "prime_mover",
        "prime_mover",
        "antagonist",
        "antagonist"
      ],
      [
        "inactive",
        "stabilizer",
        "stabilizer",
        "prime_mover",
        "antagonist",
        "inactive",
        "inactive",
        "inactive",
        "inactive",
        "inactive",
        "stabilizer",
        "stabilizer",
        "inactive",
        "inactive",
        "prime_mover",
        "prime_mover",
        "prime_mover",
        "antagonist",
        "antagonist"
      ],
      [
        "inactive",
        "stabilizer",
        "stabilizer",
        "prime_mover",
        "antagonist",
        "inactive",
        "inactive",
        "inactive",
        "inactive",
        "inactive",
        "stabilizer",
        "stabilizer",
        "inactive",
        "inactive",
        "prime_mover",
        "prime_mover",
        "prime_mover",
        "antagonist",
        "antagonist"
      ],
      [
        "inactive",
        "stabilizer",
        "stabilizer",
        "prime_mover",
        "antagonist",
        "inactive",
        "inactive",
        "inactive",
        "inactive",
        "inactive",
        "prime_mover",
        "stabilizer",
        "inactive",
        "inactive",
        "prime_mover",
        "prime_mover",
        "prime_mover",
        "antagonist",
        "antagonist"
      ],
      [
        "inactive",
        "stabilizer",
        "stabilizer",
        "prime_mover",
        "antagonist",
        "inactive",
        "inactive",
        "inactive",
        "inactive",
        "inactive",
        "prime_mover",
        "prime_mover",
        "inactive",
        "inactive",
        "prime_mover",
        "prime_mover",
        "prime_mover",
        "antagonist",
        "antagonist"
      ],
      [
        "inactive",
        "stabilizer",
        "stabilizer",
        "prime_mover",
        "antagonist",
        "inactive",
        "inactive",
        "inactive",
        "inactive",
        "inactive",
        "prime_mover",
        "prime_mover",
        "inactive",
        "inactive",
        "prime_mover",